number,value,datetime_start,datetime_complete,duration,params_batch_size,params_dropout,params_freeze,params_lr,params_model_key,params_optimizer,params_scheduler,params_use_cbam,params_weight_decay,state
0,0.9061559103172281,2026-07-03 07:57:47.162411,2026-07-03 08:06:42.663611,0 days 00:08:55.501200,16,0.3005575058716044,none,1.493656855461762e-05,densenet121,AdamW,cosine,False,0.0029154431891537554,COMPLETE
1,0.0,2026-07-03 08:06:42.831413,2026-07-03 08:06:43.022185,0 days 00:00:00.190772,16,0.22803499210851796,partial,7.52374288453485e-05,densenet121,AdamW,step,True,2.9204338471814107e-05,COMPLETE
2,0.8541825542531658,2026-07-03 08:06:43.172146,2026-07-03 08:15:20.741669,0 days 00:08:37.569523,16,0.06101911742238941,none,0.0011290133559092666,densenet121,SGD,cosine,False,5.762487216478604e-05,COMPLETE
3,0.0,2026-07-03 08:15:20.889944,2026-07-03 08:15:21.091606,0 days 00:00:00.201662,16,0.04424625102595975,partial,0.0006218704727769079,densenet121,SGD,step,True,0.0048696409415209,COMPLETE
4,0.0,2026-07-03 08:15:21.241403,2026-07-03 08:15:21.448878,0 days 00:00:00.207475,16,0.0027610585618011996,partial,0.0020736445177905022,densenet121,AdamW,onecycle,True,6.235377135673162e-06,COMPLETE
5,0.0,2026-07-03 08:15:21.599028,2026-07-03 08:15:21.797560,0 days 00:00:00.198532,16,0.44360637128816327,partial,0.0015446089075047066,densenet121,Adam,onecycle,True,0.0003550012525851161,COMPLETE
6,0.0,2026-07-03 08:15:21.952460,2026-07-03 08:15:22.260418,0 days 00:00:00.307958,32,0.4537832369630465,none,8.771380343280557e-05,densenet121,Adam,onecycle,True,0.00010821382910613992,COMPLETE
7,0.7570179475379659,2026-07-03 08:15:22.410534,2026-07-03 08:17:35.750430,0 days 00:02:13.339896,16,0.40372007758203127,full,0.004760767751809498,densenet121,Adam,cosine,False,0.00014367095138664247,PRUNED
8,0.0,2026-07-03 08:17:35.906924,2026-07-03 08:17:36.122332,0 days 00:00:00.215408,16,0.25939531087168305,none,0.0067410742656406975,densenet121,AdamW,onecycle,True,1.9625093208439877e-05,COMPLETE
9,0.7832287826493451,2026-07-03 08:17:36.273184,2026-07-03 08:19:56.637228,0 days 00:02:20.364044,32,0.07244743604561155,full,0.0053063715752208465,densenet121,SGD,cosine,False,9.083381663660597e-06,PRUNED
10,0.8396253063976746,2026-07-03 08:19:56.793912,2026-07-03 08:22:58.249039,0 days 00:03:01.455127,32,0.2988970778284403,none,1.0535179945522733e-05,densenet121,AdamW,cosine,False,1.1799062523159305e-06,PRUNED
11,0.5495199733306086,2026-07-03 08:22:58.411655,2026-07-03 08:25:56.439268,0 days 00:02:58.027613,16,0.14292715422254962,none,1.3215069923225928e-05,densenet121,SGD,cosine,False,0.00607070151418308,PRUNED
12,0.7840045717283569,2026-07-03 08:25:56.599800,2026-07-03 08:28:56.445838,0 days 00:02:59.846038,16,0.3499183003773466,none,0.00023345947067353613,densenet121,SGD,cosine,False,0.0009039901376803895,PRUNED
13,0.5577542206517472,2026-07-03 08:28:56.610466,2026-07-03 08:32:00.420014,0 days 00:03:03.809548,16,0.15461219401896528,none,4.210060503334369e-05,densenet121,SGD,cosine,False,0.0017750229129693854,PRUNED
14,0.9110521236919813,2026-07-03 08:32:00.584602,2026-07-03 08:41:00.595679,0 days 00:09:00.011077,32,0.17046422781287812,none,0.0003099246938221804,densenet121,AdamW,cosine,False,0.001016807565686489,COMPLETE
15,0.9252219886551505,2026-07-03 08:41:00.749342,2026-07-03 08:50:00.679155,0 days 00:08:59.929813,32,0.1771965044783667,none,0.00028571338635403014,densenet121,AdamW,cosine,False,0.0013449332079949277,COMPLETE
16,0.7826198312488779,2026-07-03 08:50:00.838459,2026-07-03 08:52:18.438634,0 days 00:02:17.600175,32,0.1531221286499025,full,0.000343821374588407,densenet121,AdamW,step,False,0.0006770505939749034,PRUNED
17,0.8123855391890364,2026-07-03 08:52:18.601086,2026-07-03 08:55:19.642106,0 days 00:03:01.041020,32,0.18982405747908573,none,0.00021551311834546472,densenet121,AdamW,cosine,False,0.00036585807437477955,PRUNED
18,0.7101748633042448,2026-07-03 08:55:19.800570,2026-07-03 08:58:20.960985,0 days 00:03:01.160415,32,0.1043361302277651,none,0.0006074372281029414,densenet121,AdamW,cosine,False,0.001632575806432788,PRUNED
19,0.7648434237995825,2026-07-03 08:58:21.123169,2026-07-03 09:00:40.441124,0 days 00:02:19.317955,32,0.2078770358316635,full,0.0001007223992923311,densenet121,AdamW,step,False,0.00025707687324190643,PRUNED
20,0.8342279058201127,2026-07-03 09:00:40.600256,2026-07-03 09:06:04.355633,0 days 00:05:23.755377,32,0.27369856055790676,none,0.0004489584108581096,densenet121,AdamW,cosine,False,0.0012744799843688384,PRUNED
21,0.8572674954839374,2026-07-03 09:06:04.519094,2026-07-03 09:11:26.148891,0 days 00:05:21.629797,32,0.31770849713906035,none,2.097619815911431e-05,densenet121,AdamW,cosine,False,0.009560045667571392,PRUNED
22,0.9163178356003467,2026-07-03 09:11:26.315551,2026-07-03 09:20:25.064212,0 days 00:08:58.748661,32,0.3659584713914403,none,2.976181935565701e-05,densenet121,AdamW,cosine,False,0.0029927990921913856,COMPLETE
23,0.9449326748012232,2026-07-03 09:20:25.214251,2026-07-03 09:29:28.000485,0 days 00:09:02.786234,32,0.36738901466096086,none,0.00014320037164520648,densenet121,AdamW,cosine,False,0.00312719005643524,COMPLETE
24,0.9447305809159505,2026-07-03 09:29:28.151105,2026-07-03 09:38:32.353502,0 days 00:09:04.202397,32,0.3750570407518749,none,4.7265312050599874e-05,densenet121,AdamW,cosine,False,0.0024185158685486514,COMPLETE
25,0.7746591210215481,2026-07-03 09:38:32.503668,2026-07-03 09:43:16.145946,0 days 00:04:43.642278,32,0.47866896070836046,none,0.0001401190851177813,densenet121,Adam,cosine,False,0.0028270043601084185,PRUNED
26,0.9320279533180751,2026-07-03 09:43:16.305037,2026-07-03 09:52:18.108712,0 days 00:09:01.803675,32,0.38436027250735644,none,6.283412946567257e-05,densenet121,AdamW,cosine,False,0.0005749588030291062,COMPLETE
27,0.9323151528794904,2026-07-03 09:52:18.266747,2026-07-03 10:01:28.260554,0 days 00:09:09.993807,32,0.3780223896578903,none,4.1633823495224064e-05,densenet121,AdamW,cosine,False,0.0004508706252206106,COMPLETE
28,0.7623653586052932,2026-07-03 10:01:28.432457,2026-07-03 10:03:47.742991,0 days 00:02:19.310534,32,0.4194998217263277,full,5.030886251510941e-05,densenet121,AdamW,step,False,0.0001976683090846218,PRUNED
29,0.9251515044122338,2026-07-03 10:03:47.904880,2026-07-03 10:11:00.157150,0 days 00:07:12.252270,32,0.3299653279692998,partial,2.416836158764442e-05,densenet121,AdamW,onecycle,False,0.0028721126980962987,COMPLETE
