number,value,datetime_start,datetime_complete,duration,params_batch_size,params_dropout,params_freeze,params_lr,params_model_key,params_optimizer,params_scheduler,params_use_cbam,params_weight_decay,state
0,0.8773807842583439,2026-07-03 06:29:59.329917,2026-07-03 06:36:47.555854,0 days 00:06:48.225937,16,0.3005575058716044,none,1.493656855461762e-05,mobilenet_v3_large,AdamW,cosine,False,0.0029154431891537554,COMPLETE
1,0.0,2026-07-03 06:36:47.705880,2026-07-03 06:36:47.853702,0 days 00:00:00.147822,16,0.22803499210851796,partial,7.52374288453485e-05,mobilenet_v3_large,AdamW,step,True,2.9204338471814107e-05,COMPLETE
2,0.8537839560549743,2026-07-03 06:36:48.002220,2026-07-03 06:43:27.765511,0 days 00:06:39.763291,16,0.06101911742238941,none,0.0011290133559092666,mobilenet_v3_large,SGD,cosine,False,5.762487216478604e-05,COMPLETE
3,0.0,2026-07-03 06:43:27.914586,2026-07-03 06:43:28.056948,0 days 00:00:00.142362,16,0.04424625102595975,partial,0.0006218704727769079,mobilenet_v3_large,SGD,step,True,0.0048696409415209,COMPLETE
4,0.0,2026-07-03 06:43:28.206030,2026-07-03 06:43:28.350612,0 days 00:00:00.144582,16,0.0027610585618011996,partial,0.0020736445177905022,mobilenet_v3_large,AdamW,onecycle,True,6.235377135673162e-06,COMPLETE
5,0.0,2026-07-03 06:43:28.500637,2026-07-03 06:43:28.641286,0 days 00:00:00.140649,16,0.44360637128816327,partial,0.0015446089075047066,mobilenet_v3_large,Adam,onecycle,True,0.0003550012525851161,COMPLETE
6,0.0,2026-07-03 06:43:28.790963,2026-07-03 06:43:29.007174,0 days 00:00:00.216211,32,0.4537832369630465,none,8.771380343280557e-05,mobilenet_v3_large,Adam,onecycle,True,0.00010821382910613992,COMPLETE
7,0.6713352007469655,2026-07-03 06:43:29.157698,2026-07-03 06:45:34.764596,0 days 00:02:05.606898,16,0.40372007758203127,full,0.004760767751809498,mobilenet_v3_large,Adam,cosine,False,0.00014367095138664247,PRUNED
8,0.0,2026-07-03 06:45:34.917614,2026-07-03 06:45:35.063459,0 days 00:00:00.145845,16,0.25939531087168305,none,0.0067410742656406975,mobilenet_v3_large,AdamW,onecycle,True,1.9625093208439877e-05,COMPLETE
9,0.8114957850719973,2026-07-03 06:45:35.212170,2026-07-03 06:47:41.934437,0 days 00:02:06.722267,32,0.07244743604561155,full,0.0053063715752208465,mobilenet_v3_large,SGD,cosine,False,9.083381663660597e-06,PRUNED
10,0.8252609014497658,2026-07-03 06:47:42.087927,2026-07-03 06:49:55.654033,0 days 00:02:13.566106,32,0.2988970778284403,none,1.0535179945522733e-05,mobilenet_v3_large,AdamW,cosine,False,1.1799062523159305e-06,PRUNED
11,0.4593558261616745,2026-07-03 06:49:55.812398,2026-07-03 06:52:11.150282,0 days 00:02:15.337884,16,0.14292715422254962,none,1.3215069923225928e-05,mobilenet_v3_large,SGD,cosine,False,0.00607070151418308,PRUNED
12,0.7588833946131078,2026-07-03 06:52:11.303167,2026-07-03 06:54:25.874116,0 days 00:02:14.570949,16,0.3499183003773466,none,0.00023345947067353613,mobilenet_v3_large,SGD,cosine,False,0.0009039901376803895,PRUNED
13,0.6907770723176068,2026-07-03 06:54:26.033533,2026-07-03 06:56:40.976123,0 days 00:02:14.942590,16,0.15461219401896528,none,4.210060503334369e-05,mobilenet_v3_large,SGD,cosine,False,0.0017750229129693854,PRUNED
14,0.9436935461903369,2026-07-03 06:56:41.129416,2026-07-03 07:03:21.559088,0 days 00:06:40.429672,32,0.17046422781287812,none,0.0003099246938221804,mobilenet_v3_large,AdamW,cosine,False,0.001016807565686489,COMPLETE
15,0.9379007270201817,2026-07-03 07:03:21.706160,2026-07-03 07:10:06.945943,0 days 00:06:45.239783,32,0.1771965044783667,none,0.00028571338635403014,mobilenet_v3_large,AdamW,cosine,False,0.0013449332079949277,COMPLETE
16,0.8692350027517887,2026-07-03 07:10:07.103968,2026-07-03 07:12:15.048686,0 days 00:02:07.944718,32,0.1531221286499025,full,0.000343821374588407,mobilenet_v3_large,AdamW,step,False,0.0006770505939749034,PRUNED
17,0.9429398052299305,2026-07-03 07:12:15.213324,2026-07-03 07:19:05.238381,0 days 00:06:50.025057,32,0.18982405747908573,none,0.00021551311834546472,mobilenet_v3_large,AdamW,cosine,False,0.00036585807437477955,COMPLETE
18,0.919108353441342,2026-07-03 07:19:05.385250,2026-07-03 07:22:38.186813,0 days 00:03:32.801563,32,0.2162810175689278,none,0.0001238029761959337,mobilenet_v3_large,AdamW,cosine,False,0.00032056466846093793,PRUNED
19,0.7380766509459322,2026-07-03 07:22:38.349363,2026-07-03 07:24:46.076196,0 days 00:02:07.726833,32,0.11779151523367282,full,3.547448239650553e-05,mobilenet_v3_large,AdamW,step,False,0.00015956026938446748,PRUNED
20,0.9061313218616589,2026-07-03 07:24:46.233707,2026-07-03 07:28:21.509480,0 days 00:03:35.275773,32,0.2135656571967356,none,0.0007686218177215623,mobilenet_v3_large,AdamW,cosine,False,0.0004936132610504782,PRUNED
21,0.9485679676287392,2026-07-03 07:28:21.671899,2026-07-03 07:35:00.798606,0 days 00:06:39.126707,32,0.19368698076812552,none,0.00023075374118537438,mobilenet_v3_large,AdamW,cosine,False,0.0014495696887262017,COMPLETE
22,0.90238441065837,2026-07-03 07:35:00.946394,2026-07-03 07:37:13.039031,0 days 00:02:12.092637,32,0.10658390512498521,none,0.00017300933362392337,mobilenet_v3_large,AdamW,cosine,False,0.0029927990921913856,PRUNED
23,0.9134912742606048,2026-07-03 07:37:13.193802,2026-07-03 07:42:26.864450,0 days 00:05:13.670648,32,0.2612589861227729,none,0.0004891205845315837,mobilenet_v3_large,AdamW,cosine,False,0.008774124357676943,PRUNED
24,0.9205624942699775,2026-07-03 07:42:27.018496,2026-07-03 07:45:58.010887,0 days 00:03:30.992391,32,0.18263597682153498,none,0.0001254695990632856,mobilenet_v3_large,AdamW,cosine,False,0.0014108089669885777,PRUNED
25,0.8990283790283791,2026-07-03 07:45:58.165719,2026-07-03 07:49:06.218110,0 days 00:03:08.052391,32,0.09912489698700341,none,0.0003889480023203545,mobilenet_v3_large,Adam,cosine,False,0.0002477919123623757,PRUNED
26,0.8606925337143672,2026-07-03 07:49:06.372488,2026-07-03 07:51:20.802650,0 days 00:02:14.430162,32,0.3299652936222782,none,4.1605436740461124e-05,mobilenet_v3_large,AdamW,cosine,False,0.0007327102327965204,PRUNED
27,0.8354280398163327,2026-07-03 07:51:20.959932,2026-07-03 07:53:26.659942,0 days 00:02:05.700010,32,0.25519653591015634,full,0.0025080443718387413,mobilenet_v3_large,AdamW,cosine,False,0.002504785730393711,PRUNED
28,0.8493988790484748,2026-07-03 07:53:26.816702,2026-07-03 07:55:31.557692,0 days 00:02:04.740990,32,0.19355102661974574,partial,0.0009036239360958179,mobilenet_v3_large,AdamW,step,False,7.760553988878967e-05,PRUNED
29,0.8898431445780174,2026-07-03 07:55:31.711652,2026-07-03 07:57:44.437108,0 days 00:02:12.725456,32,0.30418593632106394,none,0.00023207596543594998,mobilenet_v3_large,AdamW,onecycle,False,0.0034589078391131867,PRUNED
